{
  "manifest_version": "0.1",
  "bundle_id": "exp001-rwkv7-world-0.4b",
  "description": "Pinned remote assets for the EXP-001 development gates.",
  "assets": [
    {
      "id": "rwkv7-world-0.4b-v2.9",
      "kind": "model",
      "destination": "models/rwkv7-world-0.4b/RWKV-x070-World-0.4B-v2.9-20250107-ctx4096.pth",
      "license": "Apache-2.0",
      "source_page": "https://huggingface.co/BlinkDL/rwkv-7-world/blob/b9edcafa66561b3004c9398f00a0007cd15edb0e/RWKV-x070-World-0.4B-v2.9-20250107-ctx4096.pth",
      "source": {
        "type": "huggingface",
        "repo_type": "model",
        "repo_id": "BlinkDL/rwkv-7-world",
        "revision": "b9edcafa66561b3004c9398f00a0007cd15edb0e",
        "filename": "RWKV-x070-World-0.4B-v2.9-20250107-ctx4096.pth"
      },
      "sha256": "c08cf602b33e59a5717b8f0cafaf7f04c50c1c67166e477aa2f47c5ca180da4a",
      "size_bytes": 901794466
    },
    {
      "id": "rwkv-world-tokenizer-20230424",
      "kind": "tokenizer",
      "destination": "tokenizers/rwkv_vocab_v20230424.txt",
      "license": "Apache-2.0",
      "source_page": "https://huggingface.co/RWKV/v6-Finch-7B-World3-HF/blob/8cc2ab5d72b0a75713a62be5192a6e39b28df0ed/rwkv_vocab_v20230424.txt",
      "source": {
        "type": "huggingface",
        "repo_type": "model",
        "repo_id": "RWKV/v6-Finch-7B-World3-HF",
        "revision": "8cc2ab5d72b0a75713a62be5192a6e39b28df0ed",
        "filename": "rwkv_vocab_v20230424.txt"
      },
      "sha256": "e6dee3d4e31b4d5c40ac99508ac6c701ceef4bed681bf2167ce9a908552bca89",
      "size_bytes": 1093733
    }
  ],
  "generated_assets": [
    {
      "id": "exp001-synthetic-dev",
      "kind": "dataset",
      "destination": "datasets/exp001/identity_goal.synthetic.dev.json",
      "generator": "psa task-generate",
      "config": "configs/tasks/exp001_identity_goal.dev.json",
      "confirmatory": false
    }
  ]
}
